{
  "kind": "reusable-data-procedure-run",
  "specVersion": "0.1",
  "runId": "case-po-material-run-01",
  "deployment": {"id": "case.manual-local", "version": "0.1"},
  "procedure": {"id": "procurement.po-material-reconciliation", "version": "0.1.0", "planHash": "case-po-plan-v1"},
  "engineVersion": "reference-case",
  "trigger": "manual",
  "actor": "case-runner",
  "status": "published",
  "startedAt": "2026-08-16T14:21:00Z",
  "finishedAt": "2026-08-16T14:21:02Z",
  "inputs": [
    {"role": "purchase_orders", "resource": "fixtures.json#sourceRuns/run-01", "hash": "sha256:synthetic-po-run-01", "fingerprint": "po-v1-ten-fields", "selectedRegion": "Purchase Orders!A7:J11", "rowCount": 4}
  ],
  "resolvedDependencies": [
    {"kind": "reference-dataset", "id": "sap.supplier-material-cross-reference", "version": "2026.08.1"}
  ],
  "drift": {"classification": "none", "findings": []},
  "validationSummary": {"passed": 4, "warnings": 0, "errors": 0, "blocking": 0},
  "exceptions": {"count": 0, "byReason": {}},
  "controlTotals": [
    {"name": "order-quantity", "expected": 72, "actual": 72, "status": "pass"},
    {"name": "supplier-material-coverage", "expected": 1.0, "actual": 1.0, "status": "pass"},
    {"name": "material-agreement", "expected": 4, "actual": 4, "status": "pass"}
  ],
  "outputs": [
    {"name": "po_material_reconciliation", "status": "published", "resource": "synthetic://case/po/run-01/result", "hash": "sha256:synthetic-po-result-01", "rowCount": 4},
    {"name": "po_material_exceptions", "status": "published", "resource": "synthetic://case/po/run-01/exceptions", "hash": "sha256:synthetic-exceptions-empty", "rowCount": 0}
  ],
  "publicationDecision": "publish",
  "metrics": {"locatorConfidence": 0.98, "mappingCoverage": 1.0, "sourceQuantity": 72, "resultQuantity": 72, "materialAgreementRate": 1.0}
}